id,title,selftext,score,num_comments,author,created_utc,url,over_18,edited,spoiler,stickied
1d068r3,DSA Prep for Data Engineering @FinTech,"Hello r/dataengineering peers,

I'm gearing up for my first Senior-level Data Engineering technical round at a top-tier Fintech company. While I'm confident with big data tech stacks like Spark, Hadoop, Kafka, Airflow AWS, etc., I struggle with Data Structures and Algorithms (DSA). I've always heard that DSA is a quick way to assess a candidate, but it seems like most Data Engineers I've spoken to use only about 2-3% of DSA skills in their roles.

Given this, which DSA topics are the most crucial to focus on for such interviews? And what level of questions should a data engineer focus on while preparing?

Additionally, if anyone has a list of practice questions on LeetCode or HackerRank that would be particularly beneficial for Data Engineering roles, please share them.

Thanks in advance!",1,0,arcofiero,2024-05-25 07:01:49,https://www.reddit.com/r/dataengineering/comments/1d068r3/dsa_prep_for_data_engineering_fintech/,False,False,False,False
1cztbgq,Data engineers in Dubai,"Can we have a meetup in Dubai for all data engineers so we can have some kind of activities networking friendships etc?
",0,0,Pumpkin-Immediate,2024-05-24 19:38:33,https://www.reddit.com/r/dataengineering/comments/1cztbgq/data_engineers_in_dubai/,False,False,False,False
1czkojd,"How to build low-latency, incremental cloud ETL pipelines with minimal coding.",,0,0,Nice_Substance_6594,2024-05-24 13:25:32,https://i.redd.it/mudf9thmld2d1.png,False,False,False,False
1cztyi9,Do you let Dr. Pepper near your keyboard? Or do you too tempt fate?,"TLDR: he spilled a pop. 

https://bearbeta.org/research/f/nasa-computer-assaulted-by-dr-pepper-26-hours-before-launch",0,3,PhecalMatter,2024-05-24 20:05:27,https://www.reddit.com/r/dataengineering/comments/1cztyi9/do_you_let_dr_pepper_near_your_keyboard_or_do_you/,False,False,False,False
